{
  "$schema": "https://json-schema.org/draft/2020-12/schema",
  "$defs": {
    "ActivityTimeFilter": {
      "additionalProperties": false,
      "properties": {
        "selection": {
          "default": "any",
          "enum": [
            "",
            "any",
            "30",
            "60",
            "120",
            "custom"
          ],
          "title": "Selection",
          "type": "string"
        },
        "customMinutes": {
          "anyOf": [
            {
              "exclusiveMinimum": 0,
              "type": "integer"
            },
            {
              "type": "null"
            }
          ],
          "default": null,
          "title": "Customminutes"
        }
      },
      "title": "ActivityTimeFilter",
      "type": "object"
    },
    "BudgetFilter": {
      "additionalProperties": false,
      "properties": {
        "selection": {
          "default": "any",
          "enum": [
            "",
            "any",
            "0",
            "10",
            "10-25",
            "custom"
          ],
          "title": "Selection",
          "type": "string"
        },
        "customDollars": {
          "anyOf": [
            {
              "minimum": 0,
              "type": "number"
            },
            {
              "type": "null"
            }
          ],
          "default": null,
          "title": "Customdollars"
        }
      },
      "title": "BudgetFilter",
      "type": "object"
    },
    "Coordinates": {
      "additionalProperties": false,
      "properties": {
        "latitude": {
          "maximum": 90,
          "minimum": -90,
          "title": "Latitude",
          "type": "number"
        },
        "longitude": {
          "maximum": 180,
          "minimum": -180,
          "title": "Longitude",
          "type": "number"
        }
      },
      "required": [
        "latitude",
        "longitude"
      ],
      "title": "Coordinates",
      "type": "object"
    },
    "DistanceFilter": {
      "additionalProperties": false,
      "properties": {
        "maxDistance": {
          "exclusiveMinimum": 0,
          "title": "Maxdistance",
          "type": "number"
        },
        "unit": {
          "const": "miles",
          "title": "Unit",
          "type": "string"
        }
      },
      "required": [
        "maxDistance",
        "unit"
      ],
      "title": "DistanceFilter",
      "type": "object"
    },
    "SelectedVibe": {
      "additionalProperties": false,
      "properties": {
        "id": {
          "anyOf": [
            {
              "maxLength": 128,
              "minLength": 1,
              "pattern": "^[^/]+$",
              "type": "string"
            },
            {
              "type": "null"
            }
          ],
          "default": null,
          "title": "Id"
        },
        "name": {
          "anyOf": [
            {
              "maxLength": 100,
              "minLength": 1,
              "type": "string"
            },
            {
              "type": "null"
            }
          ],
          "default": null,
          "title": "Name"
        },
        "preferences": {
          "maxLength": 4000,
          "minLength": 1,
          "title": "Preferences",
          "type": "string"
        }
      },
      "required": [
        "preferences"
      ],
      "title": "SelectedVibe",
      "type": "object"
    }
  },
  "additionalProperties": false,
  "properties": {
    "preferences": {
      "default": "",
      "maxLength": 4000,
      "title": "Preferences",
      "type": "string"
    },
    "username": {
      "default": "",
      "description": "Untrusted display text; not used for identity or profile updates.",
      "maxLength": 160,
      "title": "Username",
      "type": "string"
    },
    "location": {
      "maxLength": 300,
      "title": "Location",
      "type": "string"
    },
    "time": {
      "$ref": "#/$defs/ActivityTimeFilter"
    },
    "budget": {
      "$ref": "#/$defs/BudgetFilter"
    },
    "distance": {
      "anyOf": [
        {
          "exclusiveMinimum": 0,
          "type": "number"
        },
        {
          "$ref": "#/$defs/DistanceFilter"
        },
        {
          "type": "null"
        }
      ],
      "default": null,
      "description": "Maximum straight-line miles: number or {maxDistance, unit: miles}; null means no limit.",
      "title": "Distance"
    },
    "goals": {
      "items": {
        "maxLength": 500,
        "minLength": 1,
        "type": "string"
      },
      "maxItems": 20,
      "title": "Goals",
      "type": "array"
    },
    "vibePreferences": {
      "anyOf": [
        {
          "maxLength": 4000,
          "type": "string"
        },
        {
          "type": "null"
        }
      ],
      "default": "",
      "title": "Vibepreferences"
    },
    "multiQuest": {
      "default": false,
      "title": "Multiquest",
      "type": "boolean"
    },
    "proofOptions": {
      "description": "Allowed per-step methods: location/photo can earn XP; recreation is fun-only and awards no XP.",
      "items": {
        "enum": [
          "location",
          "photo",
          "recreation"
        ],
        "type": "string"
      },
      "maxItems": 3,
      "minItems": 1,
      "title": "Proofoptions",
      "type": "array"
    },
    "originCoordinates": {
      "anyOf": [
        {
          "$ref": "#/$defs/Coordinates"
        },
        {
          "type": "null"
        }
      ],
      "default": null,
      "description": "Coordinates of the selected search origin; required for distance filtering."
    },
    "activeVibe": {
      "anyOf": [
        {
          "$ref": "#/$defs/SelectedVibe"
        },
        {
          "type": "null"
        }
      ],
      "default": null
    }
  },
  "required": [
    "location",
    "time",
    "budget"
  ],
  "title": "GenerateQuestRequest",
  "type": "object"
}
