{
  "preferences": "I enjoy programming and want to learn more programming in my sidequests while also going out into nature to enjoy the outside world more since i love the greenery.",
  "username": "Jaxon Perez",
  "location": "101 Museum Rd, Gainesville, FL 32603, USA",
  "time": {"selection": "120", "customMinutes": null},
  "budget": {"selection": "10-25", "customDollars": null},
  "distance": null,
  "goals": ["Learn Computer Science"],
  "vibePreferences": "I want to play some games and have fun recreationaly",
  "multiQuest": false
}
